{
  "schema_version": 1,
  "scope": "orchestrator-development",
  "id": "DEV-20260806-010",
  "title": "F1 B0 wall-clock에 사용자 주의 지연 혼입",
  "status": "resolved",
  "stage": "benchmark-runner-f1",
  "category": "design",
  "discovered_at": "2026-08-06T06:00:56Z",
  "resolved_at": "2026-08-06T06:01:26Z",
  "discovered_by": "F1 revision 3 live comparison",
  "symptom": "B0 실행시간이 모델 작업뿐 아니라 사용자가 다른 작업을 하다가 T1 완료를 확인하고 T2를 전달한 대기시간까지 포함했다",
  "reproduction": [
    "B0 T1을 보낸 뒤 사용자가 다른 작업을 수행하고 나중에 T2를 전달하는 순차 Cell을 실행한다"
  ],
  "evidence": [
    {
      "kind": "direct-observation",
      "detail": "exp_20260806_bac45bc4_3에서 코드 B0 497.109초 대 B1 89.047초, 문서 B0 166.328초 대 B1 78.172초가 기록됐지만 B0 relay 대기는 통제되지 않았다"
    }
  ],
  "root_cause": "F1은 B0의 운영 wall-clock을 측정했지만 통제된 실행 성능과 자연 사용 중 사람 응답 지연을 별도 지표와 별도 실험으로 분리하지 않았다",
  "considered_options": [
    {
      "option": "현재 B0/B1 시간 차이를 B1 속도 우위로 채택",
      "decision": "rejected",
      "reason": "사용자 응답 지연이라는 교란 요인을 원인 효과로 오해한다"
    },
    {
      "option": "F1을 기능 확인만 남기고 부분 종료",
      "decision": "adopted",
      "reason": "확인된 자동 중계 기능은 유지하되 성능·채택 판정은 발행하지 않는다"
    },
    {
      "option": "통제 자동 기준선과 자연 사용 로그를 분리",
      "decision": "deferred",
      "reason": "순수 실행 성능과 실제 주의 비용을 각각 측정한다"
    }
  ],
  "resolution": "revision 3를 4개 SEALED Cell에서 부분 종료하고 PREPARED workspace를 보존 이동했다. Measurement 4개와 termination 기록을 저장소에 남기고 performance_verdict를 not_evaluated로 고정했다",
  "affected_files": [
    "benchmarks/results/partial/exp_20260806_bac45bc4_3/termination.json",
    "benchmarks/results/partial/exp_20260806_bac45bc4_3/README.md",
    "docs/operations/codex-revision-log.md"
  ],
  "regression_tests": [
    "termination.json의 performance_verdict=not_evaluated, adoption_verdict=not_issued와 Measurement SHA-256 4개를 검증한다"
  ],
  "verification": [
    "4개 Measurement 모두 completed, check_success=true, scope_ok=true, secret_findings=0이며 저장된 SHA-256이 로컬 봉인 원본과 일치한다"
  ],
  "remaining_risks": [],
  "related_commits": [],
  "source_references": []
}
