{
  "schema_version": 1,
  "scope": "orchestrator-development",
  "id": "DEV-20260805-015",
  "title": "R5 export scanner가 JSON 이스케이프된 Windows 홈 경로를 누락",
  "status": "resolved",
  "stage": "benchmark-runner-r5",
  "category": "implementation",
  "discovered_at": "2026-08-05T07:43:15Z",
  "resolved_at": "2026-08-05T07:43:27Z",
  "discovered_by": "R5 sanitized export security test",
  "symptom": "Evidence JSON의 Windows 홈 경로가 이중 백슬래시로 직렬화되면 export 안전성 검사가 이를 탐지하지 못하고 파일을 내보낸다",
  "reproduction": [
    "sealed Evidence에 C:\\Users\\alex\\private\\file.txt 문자열을 넣고 export_r5_experiment를 실행한다"
  ],
  "evidence": [
    {
      "kind": "reproducible-test",
      "detail": "test_r5_export_blocks_sensitive_sealed_evidence의 Windows 경로 case가 DID NOT RAISE로 실패했다"
    }
  ],
  "root_cause": "export scanner가 UTF-8 JSON 원문에 정규식을 직접 적용해 C:\\Users 형태만 검사했고 JSON 직렬화가 만든 C:\\\\Users 형태를 실제 경로 문자열로 정규화하지 않았다",
  "considered_options": [
    {
      "option": "Windows 경로 검사를 제거",
      "decision": "rejected",
      "reason": "홈 절대 경로와 사용자명을 저장소에 노출한다"
    },
    {
      "option": "JSON 이스케이프 백슬래시를 정규화한 별도 scan_text 검사",
      "decision": "adopted",
      "reason": "봉인 bytes와 hash는 바꾸지 않으면서 직렬화 표현과 실제 문자열 표현을 모두 차단한다"
    }
  ],
  "resolution": "원본 bytes는 수정하지 않고 보안 검사 입력에서 이중 백슬래시를 단일 백슬래시로 정규화한 뒤 auth.json과 token·email·홈 경로 패턴을 검사한다",
  "affected_files": [
    "tools/benchmark-runner/src/benchmark_runner/runner.py"
  ],
  "regression_tests": [
    "tools/benchmark-runner/tests/test_r5_reporter.py::test_r5_export_blocks_sensitive_sealed_evidence",
    "tools/benchmark-runner/tests/test_r5_reporter.py::test_r5_export_scans_ascii_secrets_inside_non_utf8_evidence"
  ],
  "verification": [
    "Windows 홈 경로를 포함한 민감정보 4종 export 차단 시험 통과",
    "비 UTF-8 Evidence 안의 ASCII token 형태 문자열 차단 시험 통과",
    "R5 시험 19개와 Benchmark Runner 전체 회귀시험 120개 통과"
  ],
  "remaining_risks": [
    "압축·암호화되거나 알려진 패턴과 다른 비밀은 내용 검사만으로 식별할 수 없으므로 그런 artifact는 봉인 전 공개 Evidence에서 제외해야 한다"
  ],
  "related_commits": [],
  "source_references": [
    "docs/design/general-benchmark-runner-design.md:1555"
  ]
}
