{
  "schema_version": 1,
  "scope": "orchestrator-development",
  "id": "DEV-20260805-012",
  "title": "B1 시작 동작을 공통 startup 지표에서 누락",
  "status": "resolved",
  "stage": "benchmark-runner-r3",
  "category": "implementation",
  "discovered_at": "2026-08-05T05:45:15Z",
  "resolved_at": "2026-08-05T05:45:15Z",
  "discovered_by": "R3 completion-contract re-audit",
  "symptom": "B0 최초 prompt는 startup_action_count 1로 계산하지만 기존 B1 Measurement는 run start를 not_applicable로 기록해 양쪽 기동 비용을 대칭 비교할 수 없다",
  "reproduction": [
    "R2 B1 FakeRuntime Cell을 봉인한 뒤 effort.startup_action_count와 manual_copy_or_relay_count_including_start를 확인한다"
  ],
  "evidence": [
    {
      "kind": "direct-observation",
      "detail": "R2 Measurement 생성 코드는 B1의 startup·including-start·excluding-start를 모두 not_applicable로 만들고 Intervention Event를 생성하지 않았다"
    }
  ],
  "root_cause": "R2 구현에서 자동 실행되는 B1 시작 명령을 사람 중계 지표 전체와 함께 제외했지만, 공통 계약은 자동/수동 여부와 별개로 양쪽 최초 기동 동작을 startup 보조 지표에 각각 1회 기록하도록 구분한다",
  "considered_options": [
    {
      "option": "B0 최초 prompt도 primary 지표에서 완전히 제거하고 기록하지 않음",
      "decision": "rejected",
      "reason": "시작을 제외하는 primary gate와 양쪽 기동 비용을 보여주는 보조 지표를 동시에 보존한다는 동결 설계에 어긋난다"
    },
    {
      "option": "B1 CLI 호출 직전에 b1_start Event를 기록하고 startup 1, excluding-start 0, including-start 1을 파생",
      "decision": "adopted",
      "reason": "B0와 같은 Event 근거를 남기면서 primary 사람 부담 지표에는 자동 시작을 섞지 않는다"
    }
  ],
  "resolution": "R2 B1 Cell에 events/interventions.jsonl을 추가해 실제 CLI 호출 직전 b1_start를 append하고 Measurement의 startup_action_count 1, excluding-start 0, including-start 1과 복구 0을 Event 근거의 derived 값으로 봉인했다",
  "affected_files": [
    "tools/benchmark-runner/src/benchmark_runner/runner.py",
    "tools/benchmark-runner/tests/test_r2_runner.py"
  ],
  "regression_tests": [
    "tools/benchmark-runner/tests/test_r2_runner.py::test_r2_b1_fake_cell_reaches_independently_judged_seal"
  ],
  "verification": [
    "B0 startup 1/excluding 3/including 4와 B1 startup 1/excluding 0/including 1을 각각 봉인하는 Benchmark Runner 전체 pytest 75개 통과"
  ],
  "remaining_risks": [
    "실제 B0/B1 반복 비교를 아직 실행하지 않아 양쪽 시작 Event의 현장 입력 절차는 미검증이다"
  ],
  "related_commits": [],
  "source_references": [
    "docs/design/general-benchmark-runner-design.md:475",
    "docs/design/general-benchmark-runner-design.md:1406"
  ]
}
